<?xml version="1.0" encoding="UTF-8"?>
<!DOCTYPE xpoc SYSTEM "../xpoc.dtd">
<xpoc xmlns="http://www.rashitoul.net/xpoc"
      xmlns:xi="http://www.w3.org/2001/XInclude"
>
  <infos>
    <val_string name="cmd" value="test"/>
    <val_string name="name" value="Plutonium Jo"/>
    <val_string name="version" value="0.1"/>
  </infos>
  
  <args>
    
    <val_size name="video_size" w="800" h="600"/>
    <val_size name="video_default_size" w="1024" h="768"/>
    
    <val_string name="stage_start" value="intro"/>

  </args>
  
  <stages>
<!--   <xi:include href="intro_poc.xml"/> -->
   <xi:include href="intro.xml"/> 
   <xi:include href="game.xml"/> 
  </stages>
  
</xpoc>
